{
  "schema_version": "rolefox.candidate-scope-manifest.v1",
  "manifest_kind": "SPEC_OR_EXPERIMENT",
  "created_at": "2026-09-14T06:13:11.911Z",
  "candidate_artifact_kind": "SPEC_OR_EXPERIMENT",
  "candidate_artifact_digest": "39f7e6d99a2d84c75396b068c5ea70084f414bc5b4a3b7d483cceb3d5503155d",
  "verification_toolchain_ref": {
    "digest": "ed621b081afd366f16fa50e658ad78c5d240313e932cc986383a63013cce85b1"
  },
  "spec_manifest_ref": {
    "path": "verification/spec-manifest-v0.1.json",
    "manifest_digest": "45105e8038a5e06932f626f68403d2a5af5659bca31e2197934f367868d39978",
    "normative_set_digest": "63b267e1f3fe12c869a17e4fd6c0cbdbad16f5ec70d4d41660c06540f34a64cc"
  },
  "required_release_scope_catalog_ref": {
    "path": "verification/required-release-scopes-v0.1.json",
    "catalog_digest": "f0067111f8f5035931619bf9fc86b46de6a9f27c2e4c8f3d48e18623dc698d85"
  },
  "research_protocol_ref": {
    "path": "verification/research/pre-w1-protocol-v0.1.json",
    "protocol_digest": "c2c85eec2ce3bb0b3cc4fd6e1d9555e06a025038d2d6e0bbd30c75eab47346ec"
  },
  "release_scope_ids": [
    "application_submit_l2",
    "calendar_busy_read",
    "calendar_tentative_cancel",
    "calendar_tentative_create",
    "calendar_tentative_update",
    "credential_revocation",
    "default_email_notification",
    "job_source_read",
    "mailbox_read",
    "mailbox_reply_l2",
    "release_v01_real_provider_joined",
    "safety_liveness_heartbeat",
    "safety_stop_alert"
  ],
  "research_scope_ids": [
    "pain_interviews",
    "rules_replay",
    "target_channel_feasibility"
  ],
  "software_capabilities_claimed": [],
  "cohort_and_criteria_frozen": true,
  "approval": {
    "status": "APPROVED",
    "approved_by": "github:AnnCYW-cm",
    "approved_at": "2026-09-14T06:31:58.000Z",
    "approver_role_version": "rolefox-sole-maintainer-v1",
    "approval_proof_digest": "c8489b0267b9110252402122a6fef150b78258d9454d01773bdadabda052a133",
    "signed_payload_digest": "adac20580cf5be7d67403264bf934aba569e27a5e5f14e1c00f11d229d4e7aa9"
  },
  "collection_guard": "APPROVED_FOR_PROTOCOL_BOUND_COLLECTION",
  "candidate_scope_manifest_id": "candidate_1683bdbd112c26f88b05f0f64a7a42a5b15e7359d9e1745bbc280ca02731fff2",
  "manifest_digest": "1683bdbd112c26f88b05f0f64a7a42a5b15e7359d9e1745bbc280ca02731fff2"
}
