{
  "schema_version": "rolefox.candidate-scope-manifest.v1",
  "manifest_kind": "SPEC_OR_EXPERIMENT",
  "created_at": "2026-09-13T09:01:48.065Z",
  "candidate_artifact_kind": "SPEC_OR_EXPERIMENT",
  "candidate_artifact_digest": "e8d1c84435e8fb8cf684c68806b466351d3ee9d2066bc309b94f1399a0208942",
  "verification_toolchain_ref": {
    "digest": "9d3dacfaf64e07b11e177bd90c91c0156cd32bdb7f2830e4ca62b1b7c2b4b1b0"
  },
  "spec_manifest_ref": {
    "path": "verification/spec-manifest-v0.1.json",
    "manifest_digest": "8c350c0214c663fc96858a497095ff935549ec5a31d46c38100015d90fe73368",
    "normative_set_digest": "daddc27b93de742de4a3869380b548b75578a32de8b122c5e1a9bbccd6000cf0"
  },
  "required_release_scope_catalog_ref": {
    "path": "verification/required-release-scopes-v0.1.json",
    "catalog_digest": "f0067111f8f5035931619bf9fc86b46de6a9f27c2e4c8f3d48e18623dc698d85"
  },
  "research_protocol_ref": {
    "path": "verification/research/pre-w1-protocol-v0.1.json",
    "protocol_digest": "c2c85eec2ce3bb0b3cc4fd6e1d9555e06a025038d2d6e0bbd30c75eab47346ec"
  },
  "release_scope_ids": [
    "application_submit_l2",
    "calendar_busy_read",
    "calendar_tentative_cancel",
    "calendar_tentative_create",
    "calendar_tentative_update",
    "credential_revocation",
    "default_email_notification",
    "job_source_read",
    "mailbox_read",
    "mailbox_reply_l2",
    "release_v01_real_provider_joined",
    "safety_liveness_heartbeat",
    "safety_stop_alert"
  ],
  "research_scope_ids": [
    "pain_interviews",
    "rules_replay",
    "target_channel_feasibility"
  ],
  "software_capabilities_claimed": [],
  "cohort_and_criteria_frozen": true,
  "approval": {
    "status": "PENDING",
    "approved_by": null,
    "approved_at": null,
    "approver_role_version": null,
    "approval_proof_digest": null,
    "signed_payload_digest": "b9be9a9e0b27a5bfc23ecde35a053f7ea3c6450b69e7951382e5706d4060a38c"
  },
  "collection_guard": "BLOCKED_UNTIL_APPROVED",
  "candidate_scope_manifest_id": "candidate_36e4798add384918b7a227bf979b9d9f0843212275c893162133a5b4b45c0eec",
  "manifest_digest": "36e4798add384918b7a227bf979b9d9f0843212275c893162133a5b4b45c0eec"
}
