{
  "schema_version": "rolefox.candidate-scope-manifest.v1",
  "manifest_kind": "SPEC_OR_EXPERIMENT",
  "created_at": "2026-09-13T09:21:09.648Z",
  "candidate_artifact_kind": "SPEC_OR_EXPERIMENT",
  "candidate_artifact_digest": "3899068c4c55b0cdd3dd65de3f67997b6f99ddc4cbaa0ede10a38d9a17183740",
  "verification_toolchain_ref": {
    "digest": "9527b076597e2f49f3e2722b638be48c924a349ff4d31ae3939a49de7c4b1ac1"
  },
  "spec_manifest_ref": {
    "path": "verification/spec-manifest-v0.1.json",
    "manifest_digest": "0f981b4a59d655c8f4d82ef1b9cf651fe4f9c137fe178a86f4979f3a88d54455",
    "normative_set_digest": "a7d46500fc40e27f09e9cf24abada02a005d2a15cf5f86ecf5cc4516b04b7f76"
  },
  "required_release_scope_catalog_ref": {
    "path": "verification/required-release-scopes-v0.1.json",
    "catalog_digest": "f0067111f8f5035931619bf9fc86b46de6a9f27c2e4c8f3d48e18623dc698d85"
  },
  "research_protocol_ref": {
    "path": "verification/research/pre-w1-protocol-v0.1.json",
    "protocol_digest": "c2c85eec2ce3bb0b3cc4fd6e1d9555e06a025038d2d6e0bbd30c75eab47346ec"
  },
  "release_scope_ids": [
    "application_submit_l2",
    "calendar_busy_read",
    "calendar_tentative_cancel",
    "calendar_tentative_create",
    "calendar_tentative_update",
    "credential_revocation",
    "default_email_notification",
    "job_source_read",
    "mailbox_read",
    "mailbox_reply_l2",
    "release_v01_real_provider_joined",
    "safety_liveness_heartbeat",
    "safety_stop_alert"
  ],
  "research_scope_ids": [
    "pain_interviews",
    "rules_replay",
    "target_channel_feasibility"
  ],
  "software_capabilities_claimed": [],
  "cohort_and_criteria_frozen": true,
  "approval": {
    "status": "PENDING",
    "approved_by": null,
    "approved_at": null,
    "approver_role_version": null,
    "approval_proof_digest": null,
    "signed_payload_digest": "df6ecc1346eee56180625092088a281fc4ab587c4720364296c47da673c7fe23"
  },
  "collection_guard": "BLOCKED_UNTIL_APPROVED",
  "candidate_scope_manifest_id": "candidate_d1b08315c4df2d518923dbaf61ca89459e8e24cf38452be953109bb36923d65b",
  "manifest_digest": "d1b08315c4df2d518923dbaf61ca89459e8e24cf38452be953109bb36923d65b"
}
