{
  "schema_version": "rolefox.candidate-scope-manifest.v1",
  "manifest_kind": "SPEC_OR_EXPERIMENT",
  "created_at": "2026-09-11T12:49:57.063Z",
  "candidate_artifact_kind": "SPEC_OR_EXPERIMENT",
  "candidate_artifact_digest": "424b337cb8618021b3b51c41a58f8a3b459241ec7800d22642f3ce03c423cd0c",
  "verification_toolchain_ref": {
    "digest": "39361d027701b36c57ec8a7b8c895e2c0d47de20a9150a87e2d9527ff167475d"
  },
  "spec_manifest_ref": {
    "path": "verification/spec-manifest-v0.1.json",
    "manifest_digest": "c1de439f2a206b1942f6e08105d9b4e31150b96fd75f9b869bf9ed1406dd71a2",
    "normative_set_digest": "5669e6837419a8c45365cff1ee37304f0c1df09aa00670d8a49acd33c66ed326"
  },
  "required_release_scope_catalog_ref": {
    "path": "verification/required-release-scopes-v0.1.json",
    "catalog_digest": "43b2b7e3cdf6420a03c15918a7a202004a9702dc8a3afb8bbf6ff0564a3b6d60"
  },
  "research_protocol_ref": {
    "path": "verification/research/pre-w1-protocol-v0.1.json",
    "protocol_digest": "3f7d5de732931e9a8eaa19dfacafaed426604e054fc3ec402be778bfdd9baa9e"
  },
  "release_scope_ids": [
    "application_submit_l2",
    "calendar_busy_read",
    "calendar_tentative_cancel",
    "calendar_tentative_create",
    "calendar_tentative_update",
    "credential_revocation",
    "default_email_notification",
    "job_source_read",
    "mailbox_read",
    "mailbox_reply_l2",
    "release_v01_real_provider_joined",
    "safety_liveness_heartbeat",
    "safety_stop_alert"
  ],
  "research_scope_ids": [
    "pain_interviews",
    "rules_replay",
    "target_channel_feasibility"
  ],
  "software_capabilities_claimed": [],
  "cohort_and_criteria_frozen": true,
  "approval": {
    "status": "PENDING",
    "approved_by": null,
    "approved_at": null,
    "approver_role_version": null,
    "approval_proof_digest": null,
    "signed_payload_digest": "b52d6f36321ff270590e475f1652347515342bcb86e1cb5f67bfcee85bb3d88e"
  },
  "collection_guard": "BLOCKED_UNTIL_APPROVED",
  "candidate_scope_manifest_id": "candidate_2b862f90dae06706067d44064b54a81cf8f687f76ddaedb06a2f9d9cf6501e20",
  "manifest_digest": "2b862f90dae06706067d44064b54a81cf8f687f76ddaedb06a2f9d9cf6501e20"
}
