{
  "schema_version": "rolefox.candidate-scope-manifest.v1",
  "manifest_kind": "SPEC_OR_EXPERIMENT",
  "created_at": "2026-09-13T09:15:17.980Z",
  "candidate_artifact_kind": "SPEC_OR_EXPERIMENT",
  "candidate_artifact_digest": "597b8e4d1acd332784047704922b453a1255a3491ff5e29bd54996428b78b9aa",
  "verification_toolchain_ref": {
    "digest": "9527b076597e2f49f3e2722b638be48c924a349ff4d31ae3939a49de7c4b1ac1"
  },
  "spec_manifest_ref": {
    "path": "verification/spec-manifest-v0.1.json",
    "manifest_digest": "696b0428ee991e2d5f1c7f0eb1eb9221cec26e1f9068826c79424e578b44eadf",
    "normative_set_digest": "daddc27b93de742de4a3869380b548b75578a32de8b122c5e1a9bbccd6000cf0"
  },
  "required_release_scope_catalog_ref": {
    "path": "verification/required-release-scopes-v0.1.json",
    "catalog_digest": "f0067111f8f5035931619bf9fc86b46de6a9f27c2e4c8f3d48e18623dc698d85"
  },
  "research_protocol_ref": {
    "path": "verification/research/pre-w1-protocol-v0.1.json",
    "protocol_digest": "c2c85eec2ce3bb0b3cc4fd6e1d9555e06a025038d2d6e0bbd30c75eab47346ec"
  },
  "release_scope_ids": [
    "application_submit_l2",
    "calendar_busy_read",
    "calendar_tentative_cancel",
    "calendar_tentative_create",
    "calendar_tentative_update",
    "credential_revocation",
    "default_email_notification",
    "job_source_read",
    "mailbox_read",
    "mailbox_reply_l2",
    "release_v01_real_provider_joined",
    "safety_liveness_heartbeat",
    "safety_stop_alert"
  ],
  "research_scope_ids": [
    "pain_interviews",
    "rules_replay",
    "target_channel_feasibility"
  ],
  "software_capabilities_claimed": [],
  "cohort_and_criteria_frozen": true,
  "approval": {
    "status": "PENDING",
    "approved_by": null,
    "approved_at": null,
    "approver_role_version": null,
    "approval_proof_digest": null,
    "signed_payload_digest": "b5fa264cd22886b26a7e4946400e62963b5e0d2df4baf434f549ae9d7e69871c"
  },
  "collection_guard": "BLOCKED_UNTIL_APPROVED",
  "candidate_scope_manifest_id": "candidate_1860442d7550ae03e581bf249788533d40c5061d18937f6e8bec0524f3c2fd84",
  "manifest_digest": "1860442d7550ae03e581bf249788533d40c5061d18937f6e8bec0524f3c2fd84"
}
