{
  "schema_version": "rolefox.candidate-scope-manifest.v1",
  "manifest_kind": "SPEC_OR_EXPERIMENT",
  "created_at": "2026-09-13T03:47:49.424Z",
  "candidate_artifact_kind": "SPEC_OR_EXPERIMENT",
  "candidate_artifact_digest": "5c399ec7768872b88d650397729fa1d7d4a4e439dcd5d2bde8740c241181eec9",
  "verification_toolchain_ref": {
    "digest": "4dd0719595657848f961ebf73368d202e718774c2ac30bf3fea278931e9c5f56"
  },
  "spec_manifest_ref": {
    "path": "verification/spec-manifest-v0.1.json",
    "manifest_digest": "f9ace13efeaf4e3ce9f54d6bde2d898b6079e6c29647c4b151b2d92809e8cc7b",
    "normative_set_digest": "19a3fc2454bff24b61a5b65f53e1be0184dad32f3f7d3c318ee022d2b2f0a26c"
  },
  "required_release_scope_catalog_ref": {
    "path": "verification/required-release-scopes-v0.1.json",
    "catalog_digest": "43b2b7e3cdf6420a03c15918a7a202004a9702dc8a3afb8bbf6ff0564a3b6d60"
  },
  "research_protocol_ref": {
    "path": "verification/research/pre-w1-protocol-v0.1.json",
    "protocol_digest": "3f7d5de732931e9a8eaa19dfacafaed426604e054fc3ec402be778bfdd9baa9e"
  },
  "release_scope_ids": [
    "application_submit_l2",
    "calendar_busy_read",
    "calendar_tentative_cancel",
    "calendar_tentative_create",
    "calendar_tentative_update",
    "credential_revocation",
    "default_email_notification",
    "job_source_read",
    "mailbox_read",
    "mailbox_reply_l2",
    "release_v01_real_provider_joined",
    "safety_liveness_heartbeat",
    "safety_stop_alert"
  ],
  "research_scope_ids": [
    "pain_interviews",
    "rules_replay",
    "target_channel_feasibility"
  ],
  "software_capabilities_claimed": [],
  "cohort_and_criteria_frozen": true,
  "approval": {
    "status": "PENDING",
    "approved_by": null,
    "approved_at": null,
    "approver_role_version": null,
    "approval_proof_digest": null,
    "signed_payload_digest": "cd0e48991129578d8e8c96f0411a08a388c308b37db9a50e46a76cce50cb6cb9"
  },
  "collection_guard": "BLOCKED_UNTIL_APPROVED",
  "candidate_scope_manifest_id": "candidate_7245bbbb1b210ae79dacdb04b59e8cd234c9a763a8d081dd518c1b545f144b4a",
  "manifest_digest": "7245bbbb1b210ae79dacdb04b59e8cd234c9a763a8d081dd518c1b545f144b4a"
}
