{
  "schema_version": "rolefox.candidate-scope-manifest.v1",
  "manifest_kind": "SPEC_OR_EXPERIMENT",
  "created_at": "2026-09-23T08:17:23.632Z",
  "candidate_artifact_kind": "SPEC_OR_EXPERIMENT",
  "candidate_artifact_digest": "aa6d7df1c850cc3873c73dac2da319c2e74192c869679fd7bcd8b7447ba33a66",
  "verification_toolchain_ref": {
    "digest": "7d7f6d8ecb6c667c950f36e5b66922f9739065971463ce72163571919a2d63a7"
  },
  "spec_manifest_ref": {
    "path": "verification/spec-manifest-v0.1.json",
    "manifest_digest": "c65903aab16eb2bae3f31bdb59f067760f3178986db9da227302803e7e8702ba",
    "normative_set_digest": "d17ceb0490876a6ad3de8838c4ba2e24e0ff59d21111ab5172e35902ade46c78"
  },
  "required_release_scope_catalog_ref": {
    "path": "verification/required-release-scopes-v0.1.json",
    "catalog_digest": "f0067111f8f5035931619bf9fc86b46de6a9f27c2e4c8f3d48e18623dc698d85"
  },
  "research_protocol_ref": {
    "path": "verification/research/pre-w1-protocol-v0.1.json",
    "protocol_digest": "c2c85eec2ce3bb0b3cc4fd6e1d9555e06a025038d2d6e0bbd30c75eab47346ec"
  },
  "release_scope_ids": [
    "application_submit_l2",
    "calendar_busy_read",
    "calendar_tentative_cancel",
    "calendar_tentative_create",
    "calendar_tentative_update",
    "credential_revocation",
    "default_email_notification",
    "job_source_read",
    "mailbox_read",
    "mailbox_reply_l2",
    "release_v01_real_provider_joined",
    "safety_liveness_heartbeat",
    "safety_stop_alert"
  ],
  "research_scope_ids": [
    "pain_interviews",
    "rules_replay",
    "target_channel_feasibility"
  ],
  "software_capabilities_claimed": [],
  "cohort_and_criteria_frozen": true,
  "approval": {
    "status": "PENDING",
    "approved_by": null,
    "approved_at": null,
    "approver_role_version": null,
    "approval_proof_digest": null,
    "signed_payload_digest": "f4123310ed17d3a4137bea67adb43097439f9c225dc20778baabc3bf28b40924"
  },
  "collection_guard": "BLOCKED_UNTIL_APPROVED",
  "candidate_scope_manifest_id": "candidate_432e2bed1211a7130312c089aa7e5fad32ad489d0989a1b63345d6859e55651e",
  "manifest_digest": "432e2bed1211a7130312c089aa7e5fad32ad489d0989a1b63345d6859e55651e"
}
