{
  "schema_version": "rolefox.candidate-scope-manifest.v1",
  "manifest_kind": "SPEC_OR_EXPERIMENT",
  "created_at": "2026-09-14T14:16:39.686Z",
  "candidate_artifact_kind": "SPEC_OR_EXPERIMENT",
  "candidate_artifact_digest": "a9cdb1637bf5f70271485da6ebe53388ee4424adbcf953670096da024bdef87b",
  "verification_toolchain_ref": {
    "digest": "af26353c1207ff050536f29315dba159036b5681e6603d4c9d90ef3c5d266a0f"
  },
  "spec_manifest_ref": {
    "path": "verification/spec-manifest-v0.1.json",
    "manifest_digest": "a6aad996c1231311f6ad7edfc2832ce0e001f73d28fca5ee561a326110a38bc8",
    "normative_set_digest": "ff674002305eee26f1cff3af511f3ed107080a98da3154fd763e5dbb9217d68b"
  },
  "required_release_scope_catalog_ref": {
    "path": "verification/required-release-scopes-v0.1.json",
    "catalog_digest": "f0067111f8f5035931619bf9fc86b46de6a9f27c2e4c8f3d48e18623dc698d85"
  },
  "research_protocol_ref": {
    "path": "verification/research/pre-w1-protocol-v0.1.json",
    "protocol_digest": "c2c85eec2ce3bb0b3cc4fd6e1d9555e06a025038d2d6e0bbd30c75eab47346ec"
  },
  "release_scope_ids": [
    "application_submit_l2",
    "calendar_busy_read",
    "calendar_tentative_cancel",
    "calendar_tentative_create",
    "calendar_tentative_update",
    "credential_revocation",
    "default_email_notification",
    "job_source_read",
    "mailbox_read",
    "mailbox_reply_l2",
    "release_v01_real_provider_joined",
    "safety_liveness_heartbeat",
    "safety_stop_alert"
  ],
  "research_scope_ids": [
    "pain_interviews",
    "rules_replay",
    "target_channel_feasibility"
  ],
  "software_capabilities_claimed": [],
  "cohort_and_criteria_frozen": true,
  "approval": {
    "status": "PENDING",
    "approved_by": null,
    "approved_at": null,
    "approver_role_version": null,
    "approval_proof_digest": null,
    "signed_payload_digest": "90d1d7d908b0fb67d5286c6a094d9568370ceeb4782fc9f1683409c89cff8df5"
  },
  "collection_guard": "BLOCKED_UNTIL_APPROVED",
  "candidate_scope_manifest_id": "candidate_bb149d8e1d83be97213dba98b90822097fd63c20b3eb6f1f9478905db6dc67bf",
  "manifest_digest": "bb149d8e1d83be97213dba98b90822097fd63c20b3eb6f1f9478905db6dc67bf"
}
