{
  "schema_version": "rolefox.candidate-scope-manifest.v1",
  "manifest_kind": "SPEC_OR_EXPERIMENT",
  "created_at": "2026-09-24T09:33:20.155Z",
  "candidate_artifact_kind": "SPEC_OR_EXPERIMENT",
  "candidate_artifact_digest": "490586256f4ea14412af48bc5ae7a9f0541e92e133b1abc9bfaf68bca3e1ad80",
  "verification_toolchain_ref": {
    "digest": "685a0660d572d8a1c5745381db86bdbd2aac0fd3cba27960b201f826e5392257"
  },
  "spec_manifest_ref": {
    "path": "verification/spec-manifest-v0.1.json",
    "manifest_digest": "08bb213bc7b01e6235f44f002040928e3b371aaca5970b39dde6742ac6a6e65f",
    "normative_set_digest": "124bb79ca9bf6db3e586628ebf60ef6cacd88f8ad600cb0df2adbf067f18ed46"
  },
  "required_release_scope_catalog_ref": {
    "path": "verification/required-release-scopes-v0.1.json",
    "catalog_digest": "f0067111f8f5035931619bf9fc86b46de6a9f27c2e4c8f3d48e18623dc698d85"
  },
  "research_protocol_ref": {
    "path": "verification/research/pre-w1-protocol-v0.1.json",
    "protocol_digest": "c2c85eec2ce3bb0b3cc4fd6e1d9555e06a025038d2d6e0bbd30c75eab47346ec"
  },
  "release_scope_ids": [
    "application_submit_l2",
    "calendar_busy_read",
    "calendar_tentative_cancel",
    "calendar_tentative_create",
    "calendar_tentative_update",
    "credential_revocation",
    "default_email_notification",
    "job_source_read",
    "mailbox_read",
    "mailbox_reply_l2",
    "release_v01_real_provider_joined",
    "safety_liveness_heartbeat",
    "safety_stop_alert"
  ],
  "research_scope_ids": [
    "pain_interviews",
    "rules_replay",
    "target_channel_feasibility"
  ],
  "software_capabilities_claimed": [],
  "cohort_and_criteria_frozen": true,
  "approval": {
    "status": "APPROVED",
    "approved_by": "github:AnnCYW-cm",
    "approved_at": "2026-09-24T09:53:41.000Z",
    "approver_role_version": "rolefox-sole-maintainer-v1",
    "approval_proof_digest": "f142927ae3927fd1a8f7da9dc086df34db666411a5a9abafa9350bc8095046ed",
    "signed_payload_digest": "a3bf5810fe9ca77c6b402820d865b47f2364dff9efe635c77f71c56f62a95d98"
  },
  "collection_guard": "APPROVED_FOR_PROTOCOL_BOUND_COLLECTION",
  "candidate_scope_manifest_id": "candidate_e0bde646d9c999e3cc85318136b5204ce46751ead582ce3817adbf8070816bc2",
  "manifest_digest": "e0bde646d9c999e3cc85318136b5204ce46751ead582ce3817adbf8070816bc2"
}
