{
  "schema_version": "rolefox.candidate-scope-manifest.v1",
  "manifest_kind": "SPEC_OR_EXPERIMENT",
  "created_at": "2026-09-14T04:49:46.604Z",
  "candidate_artifact_kind": "SPEC_OR_EXPERIMENT",
  "candidate_artifact_digest": "71342e0c1f307699722c5cb3635a1fecb5425a7a20007a81dea2a2fd32061d30",
  "verification_toolchain_ref": {
    "digest": "2696cd4320ba6667f0cd3d908f80aef4bb9718d23ec1e76888919dd43330c981"
  },
  "spec_manifest_ref": {
    "path": "verification/spec-manifest-v0.1.json",
    "manifest_digest": "f5a137695bbdcdd73d35faa20d0f38587b5577b156004e8ffe1e4dd923ce164a",
    "normative_set_digest": "d4b24766cca80eae06d59d2bdc1bbaebd2852fab25d2cad7e2f28703ca5cda30"
  },
  "required_release_scope_catalog_ref": {
    "path": "verification/required-release-scopes-v0.1.json",
    "catalog_digest": "f0067111f8f5035931619bf9fc86b46de6a9f27c2e4c8f3d48e18623dc698d85"
  },
  "research_protocol_ref": {
    "path": "verification/research/pre-w1-protocol-v0.1.json",
    "protocol_digest": "c2c85eec2ce3bb0b3cc4fd6e1d9555e06a025038d2d6e0bbd30c75eab47346ec"
  },
  "release_scope_ids": [
    "application_submit_l2",
    "calendar_busy_read",
    "calendar_tentative_cancel",
    "calendar_tentative_create",
    "calendar_tentative_update",
    "credential_revocation",
    "default_email_notification",
    "job_source_read",
    "mailbox_read",
    "mailbox_reply_l2",
    "release_v01_real_provider_joined",
    "safety_liveness_heartbeat",
    "safety_stop_alert"
  ],
  "research_scope_ids": [
    "pain_interviews",
    "rules_replay",
    "target_channel_feasibility"
  ],
  "software_capabilities_claimed": [],
  "cohort_and_criteria_frozen": true,
  "approval": {
    "status": "APPROVED",
    "approved_by": "github:AnnCYW-cm",
    "approved_at": "2026-09-14T05:01:53.000Z",
    "approver_role_version": "rolefox-sole-maintainer-v1",
    "approval_proof_digest": "9bed8a5d659d21b43ab9442a5052f842a4a6d9177e551fa048a9dd891f2c103c",
    "signed_payload_digest": "a421d109a5adaf334f598d650583ebd8ab74ee65c106451bb2b9509f5d7088a0"
  },
  "collection_guard": "APPROVED_FOR_PROTOCOL_BOUND_COLLECTION",
  "candidate_scope_manifest_id": "candidate_0f92a0d44a90840207bc583aeafdfe380854603fc5d6038dba0917d2e1abbada",
  "manifest_digest": "0f92a0d44a90840207bc583aeafdfe380854603fc5d6038dba0917d2e1abbada"
}
