{
  "schema_version": "rolefox.candidate-scope-manifest.v1",
  "manifest_kind": "SPEC_OR_EXPERIMENT",
  "created_at": "2026-09-13T05:41:46.814Z",
  "candidate_artifact_kind": "SPEC_OR_EXPERIMENT",
  "candidate_artifact_digest": "f027f5507b948d06e135f1d6bb9ffb8e7135e4d4734a9963c0cee79574d84943",
  "verification_toolchain_ref": {
    "digest": "f21dfbcb2d3673bc391ec255039bd3e2e29d770047ba7158540faa2210c21f68"
  },
  "spec_manifest_ref": {
    "path": "verification/spec-manifest-v0.1.json",
    "manifest_digest": "1459ca389f136e063b8a54dc66ccfa586a04ab6c18767fd9facbc2cca162e0cb",
    "normative_set_digest": "58f3aff7bbd23b51f83d9c9cac66ef9cd129a0758286f0075bc67cf0123faafa"
  },
  "required_release_scope_catalog_ref": {
    "path": "verification/required-release-scopes-v0.1.json",
    "catalog_digest": "f0067111f8f5035931619bf9fc86b46de6a9f27c2e4c8f3d48e18623dc698d85"
  },
  "research_protocol_ref": {
    "path": "verification/research/pre-w1-protocol-v0.1.json",
    "protocol_digest": "c2c85eec2ce3bb0b3cc4fd6e1d9555e06a025038d2d6e0bbd30c75eab47346ec"
  },
  "release_scope_ids": [
    "application_submit_l2",
    "calendar_busy_read",
    "calendar_tentative_cancel",
    "calendar_tentative_create",
    "calendar_tentative_update",
    "credential_revocation",
    "default_email_notification",
    "job_source_read",
    "mailbox_read",
    "mailbox_reply_l2",
    "release_v01_real_provider_joined",
    "safety_liveness_heartbeat",
    "safety_stop_alert"
  ],
  "research_scope_ids": [
    "pain_interviews",
    "rules_replay",
    "target_channel_feasibility"
  ],
  "software_capabilities_claimed": [],
  "cohort_and_criteria_frozen": true,
  "approval": {
    "status": "PENDING",
    "approved_by": null,
    "approved_at": null,
    "approver_role_version": null,
    "approval_proof_digest": null,
    "signed_payload_digest": "534a49a92586fb851a29ef0dfbc8dec078945622a1a8a72c79aa39851db11456"
  },
  "collection_guard": "BLOCKED_UNTIL_APPROVED",
  "candidate_scope_manifest_id": "candidate_687bf921a70566a62d47b53b7210e1aa2bc6169cc8fdbddbef5a930cc4684540",
  "manifest_digest": "687bf921a70566a62d47b53b7210e1aa2bc6169cc8fdbddbef5a930cc4684540"
}
